{
  "schema_version": "1.0",
  "review_id": "review-1",
  "run_id": "run-valid",
  "created_at": "2026-05-15T00:00:00Z",
  "items": [
    {
      "review_item_id": "review-item-1",
      "item_type": "missing_required_information",
      "target_file": "user_profile.json",
      "target_json_pointer": "/preferences/availability",
      "summary": "Availability should be confirmed before outreach timing is finalized.",
      "proposed_value": "Available from September 2026",
      "provenance": {
        "source_type": "needs_review",
        "confidence": 0.4,
        "needs_review": true,
        "source_refs": ["interview:availability"]
      },
      "confidence": 0.4,
      "state": "open",
      "reviewer_metadata": {},
      "resolution_notes": []
    },
    {
      "review_item_id": "review-item-2",
      "item_type": "contradiction",
      "target_file": "policy.json",
      "target_json_pointer": "/limits/daily_send_limit",
      "related_json_pointers": ["/limits/weekly_send_limit"],
      "summary": "Daily and weekly send limits need explicit confirmation.",
      "proposed_value": 0,
      "provenance": {
        "source_type": "needs_review",
        "confidence": 0.5,
        "needs_review": true,
        "source_refs": ["interview:send_limits"]
      },
      "confidence": 0.5,
      "state": "open",
      "reviewer_metadata": {},
      "resolution_notes": []
    }
  ]
}
